{
  "schema_version": "1.0.0",
  "channel": "DoesItAutomate",
  "artifact_id": "PV-POC-006",
  "content": {
    "mode": "ILLUSTRATIVE_POC",
    "language": "en",
    "headline": "An idea becomes a video",
    "evidence_refs": [],
    "mock_disclosure": "DEMO UI / ILLUSTRATIVE — no real benchmark result"
  },
  "visual": {
    "style_profile": "DIA_DARK_TECH_V1",
    "direction_accepted": true,
    "logo_state": "NOT_EMBEDDED",
    "beats": [
      {
        "start_frame": 0,
        "end_frame": 59,
        "from_state": "idea input",
        "to_state": "video preview card",
        "purpose": "A concept becomes a visible video object"
      },
      {
        "start_frame": 59,
        "end_frame": 99,
        "from_state": "raw concept",
        "to_state": "script editor",
        "purpose": "The script is written as the first processing stage"
      },
      {
        "start_frame": 99,
        "end_frame": 142,
        "from_state": "wireframe",
        "to_state": "arranged UI",
        "purpose": "Show construction of design rather than a static label"
      },
      {
        "start_frame": 142,
        "end_frame": 195,
        "from_state": "designed layout",
        "to_state": "render progress",
        "purpose": "Show frames entering the encoding/export stage"
      },
      {
        "start_frame": 195,
        "end_frame": 258,
        "from_state": "unchecked output",
        "to_state": "illustrative QA checks",
        "purpose": "Show demo review stages without asserting verified real outcomes"
      },
      {
        "start_frame": 258,
        "end_frame": 300,
        "from_state": "illustrative QA",
        "to_state": "final demo summary",
        "purpose": "Signal the end of the explanation, not publication readiness"
      }
    ]
  },
  "narration": {
    "source": "OWNER_HUMAN",
    "language": "en",
    "reference_storage": "PRIVATE_LOCAL",
    "owner_permission": true,
    "audio_embedded": true
  },
  "format": {
    "width": 1080,
    "height": 1920,
    "fps": 30,
    "duration_frames": 300,
    "video_codec": "h264",
    "audio_codec": "aac"
  },
  "captions": {
    "language": "en",
    "safe_zone_profile": "POC_UNVERIFIED",
    "margins_px": {
      "top": 220,
      "bottom": 350,
      "left": 85,
      "right": 85
    },
    "intervals": [
      {
        "start_frame": 8,
        "end_frame": 59,
        "text": "An idea becomes a video."
      },
      {
        "start_frame": 59,
        "end_frame": 99,
        "text": "First, the script."
      },
      {
        "start_frame": 100,
        "end_frame": 194,
        "text": "Then, the design and render."
      },
      {
        "start_frame": 195,
        "end_frame": 248,
        "text": "Finally, we validate the result."
      }
    ]
  },
  "budget": {
    "paid_api_usd": 0,
    "github_actions_for_media": false
  },
  "qa": {
    "technical": "PASS",
    "human_editorial": "PENDING",
    "brand": "PENDING",
    "platform_safe_area": "PENDING",
    "rights": "PENDING",
    "audio_captions": "PENDING"
  },
  "distribution": {
    "approval_state": "BLOCKED",
    "human_release_approval_ref": null,
    "publish_authority": "NONE",
    "provider_receipt": null
  },
  "output_sha256": "bc17ebb25da40252abc092afb420a97695ec9d0b0f80e50cfc152d1d98dfce98"
}
